{
  "$schema": "../../schemas/config.schema.json",
  "schemaVersion": 1,
  "project": { "id": "northstar-shop", "name": "Northstar Shop" },
  "stableBranch": "main",
  "repositories": [
    { "id": "storefront", "path": ".", "required": true },
    { "id": "orders-api", "remote": "https://code.example.invalid/northstar/orders-api.git", "required": true }
  ],
  "environments": [
    { "id": "test", "kind": "test" },
    { "id": "production", "kind": "production" }
  ],
  "documentTypes": ["product-requirement", "technical-design", "issue-report"],
  "paths": {
    "versions": ".deliveryguard/versions",
    "acceptance": ".deliveryguard/acceptance",
    "repairs": ".deliveryguard/repairs",
    "openspec": "openspec/changes"
  },
  "review": { "policy": "reviews/policy.json", "records": ["reviews/hotfix.json"] },
  "policies": {
    "requireOpenSpec": true,
    "requireAcceptanceBeforeRelease": true,
    "requireDedicatedWorktree": true
  }
}
